{
  "spec_id": "FEAT-XXX",
  "dispatch_id": "qa-9f4d2b",
  "role": "qa",
  "status": "needs_review",

  "summary": "Validated AC-001 and AC-002 (passed); AC-003 fails at exact expiry instant.",

  "evidence": [
    { "id": "EV-001", "kind": "file",    "path": "src/foo/bar.ts", "lines": "12-44", "reason": "expiry check under review" },
    { "id": "EV-002", "kind": "command", "cmd": "yarn test src/foo/bar.test.ts", "exit_code": 0, "log_path": ".agent-session/FEAT-XXX/logs/qa-1740832192.log", "duration_ms": 4210 },
    { "id": "EV-003", "kind": "test",    "name": "POST /reset returns 410 when token expired", "status": "passed", "ac_ref": "FEAT-XXX/AC-001", "output_path": ".agent-session/FEAT-XXX/tests/reset-expired.log" },
    { "id": "EV-004", "kind": "test",    "name": "POST /reset at exact expiry instant", "status": "failed", "ac_ref": "FEAT-XXX/AC-003", "output_path": ".agent-session/FEAT-XXX/tests/reset-edge.log" },
    { "id": "EV-005", "kind": "log",     "path": ".agent-session/FEAT-XXX/tests/reset-edge.log", "pattern_matched": "expected 410, got 200", "line_range": "12-15" },
    { "id": "EV-006", "kind": "url",     "url": "https://github.com/org/repo/pull/512", "title": "feat: password reset flow" },
    { "id": "EV-007", "kind": "absence", "checked": "presence of 'token expired' in /api/login success response", "expected_not_present": "token expired", "method": "grep on response body", "location": ".agent-session/FEAT-XXX/tests/login-valid.log" }
  ],

  "findings": [
    {
      "id": "FIND-001",
      "severity": "error",
      "rationale": "Off-by-one at exact expiry instant — uses < instead of <=.",
      "evidence_ref": "EV-004",
      "ac_ref": "FEAT-XXX/AC-003",
      "suggested_fix": "Change < to <= at src/foo/bar.ts:52"
    }
  ],

  "blockers": [],

  "next_role": "dev",

  "ac_coverage": {
    "FEAT-XXX/AC-001": ["EV-003"],
    "FEAT-XXX/AC-002": ["EV-002"],
    "FEAT-XXX/AC-003": ["EV-004"]
  }
}
